{
  "tabs": [
    {"id": "11111111-1111-1111-1111-111111111111", "title": "Example", "url": "https://example.com", "space": "Persönlich", "pinned": false, "kind": "web"}
  ],
  "activeID": null,
  "space": "Persönlich",
  "closedTabs": [],
  "spaces": ["Persönlich", "Studio"],
  "spaceIcons": {},
  "folders": [{"id": "22222222-2222-2222-2222-222222222222", "name": "Lesen", "space": "Persönlich", "collapsed": false, "color": "moss"}],
  "splitPairs": []
}
